Mã,Trạng thái dữ liệu,Ngày,Giá,RSI,Drawdown 20 phiên %,Hồi từ đáy 20 phiên %,Ret 5 phiên %,Ret 10 phiên %,Volume Ratio,Đã lấy lại MA5,Thủng đáy 20 phiên,Số mẫu bottom tương tự,Win T+3 %,Win T+5 %,Win T+10 %,Lợi TB T+3 %,Lợi TB T+5 %,Lợi TB T+10 %,Drawdown TB T+5 %,Điểm Bottom V15.1,Phân loại Bottom V15.1,Kết luận,Điểm mạnh,Điểm yếu,Số dòng lịch sử
BSR,OK,2026-05-12,28.05,56.46,-1.58,21.17,4.86,12.2,0.77,CÓ,KHÔNG,16,68.75,68.75,50.0,1.71,3.23,7.48,-2.59,60.0,🟡 HỒI KỸ THUẬT,Có hồi nhưng chưa đủ mạnh để xác nhận đáy chất lượng.,Đã lấy lại MA5 | Win T+5 tốt 68.8% | Lợi TB T+5 tốt 3.23%,"RSI không còn vùng đáy 56.5 | Chưa giảm đủ sâu | Hồi quá xa, không còn điểm đáy đẹp",582
QNS,OK,2026-05-12,48.9,76.19,-0.61,11.14,5.84,10.63,2.43,CÓ,KHÔNG,31,51.61,54.84,67.74,0.36,0.51,1.05,-2.71,54.0,🔴 BULL TRAP,Có hồi nhưng rủi ro gãy lại còn cao.,Đã lấy lại MA5 | Nến đóng gần cao nhất phiên,RSI không còn vùng đáy 76.2 | Chưa giảm đủ sâu,590
DIG,OK,2026-05-12,14.8,57.89,-1.99,6.86,3.5,5.34,1.17,CÓ,KHÔNG,86,34.88,34.88,44.19,-0.39,-0.82,-1.27,-3.87,52.0,🔴 BULL TRAP,Có hồi nhưng rủi ro gãy lại còn cao.,Hồi từ đáy 6.9% | Đã lấy lại MA5 | Nến đóng gần cao nhất phiên | Volume hồi hợp lý 1.17,RSI không còn vùng đáy 57.9 | Chưa giảm đủ sâu | Win T+5 yếu 34.9% | Lợi TB T+5 âm -0.82%,590
DXG,OK,2026-05-12,16.2,69.7,-1.82,12.89,5.54,11.72,1.48,CÓ,KHÔNG,82,47.56,48.78,51.22,0.06,0.01,0.33,-3.93,48.0,🔴 BULL TRAP,Có hồi nhưng rủi ro gãy lại còn cao.,Đã lấy lại MA5 | Volume hồi hợp lý 1.48,"RSI không còn vùng đáy 69.7 | Chưa giảm đủ sâu | Hồi quá xa, không còn điểm đáy đẹp",590
IVS,OK,2026-05-12,7.2,68.42,-1.37,18.03,12.5,10.77,3.2,CÓ,KHÔNG,26,26.92,23.08,7.69,-1.69,-1.78,-4.17,-5.24,27.0,⚫ DAO RƠI,"Giảm yếu, chưa có xác nhận hồi đáng tin.",Đã lấy lại MA5 | Nến đóng gần cao nhất phiên,"RSI không còn vùng đáy 68.4 | Chưa giảm đủ sâu | Hồi quá xa, không còn điểm đáy đẹp | Volume quá đột biến 3.20 | Win T+5 yếu 23.1% | Lợi TB T+5 âm -1.78%",590
